{"$id":"https://github.com/gorou5/datumoj/schemas/module.schema.json","$schema":"https://json-schema.org/draft/2020-12/schema","additionalProperties":true,"description":"Machine-readable description of a reusable module: connector, skill, agent, MCP server, worker, tool or workflow.","properties":{"country_region":{"type":"string"},"data_source":{"description":"data-source id from the catalog, if this module wraps one","type":"string"},"dependencies":{"items":{"type":"string"},"type":"array"},"description":{"description":"What problem this module solves, in one or two sentences","minLength":1,"type":"string"},"error_model":{"type":"string"},"id":{"description":"Globally unique kebab-case identifier","pattern":"^[a-z0-9]+(-[a-z0-9]+)*$","type":"string"},"inputs":{"items":{"additionalProperties":true,"properties":{"description":{"type":"string"},"name":{"type":"string"},"required":{"type":"boolean"},"type":{"type":"string"}},"required":["name"],"type":"object"},"type":"array"},"invocation":{"additionalProperties":true,"properties":{"detail":{"description":"How to invoke: command, endpoint, tool name…","type":"string"},"kind":{"enum":["function","cli","http","mcp","agent-tool","file-io","queue","other"],"type":"string"}},"required":["kind"],"type":"object"},"kind":{"enum":["connector","skill","agent","mcp-server","worker","tool","workflow","example","other"],"type":"string"},"license":{"type":"string"},"maintainers":{"items":{"type":"string"},"type":"array"},"name":{"minLength":1,"type":"string"},"outputs":{"type":"string"},"permissions":{"description":"Required permissions / secrets names (names only, never values)","items":{"type":"string"},"type":"array"},"repository":{"description":"Path within this repo, e.g. connectors/jp/nta","type":"string"},"runtime":{"description":"Where it runs, e.g. cloudflare-workers / local-python / any. Be honest about limits.","type":"string"},"status":{"default":"experimental","enum":["active","experimental","deprecated","unknown"],"type":"string"},"test":{"description":"Minimal steps to verify the module works","type":"string"},"version":{"description":"Semantic version","pattern":"^[0-9]+\\.[0-9]+\\.[0-9]+(-[a-z0-9.-]+)?$","type":"string"}},"required":["id","name","kind","version","description"],"title":"Reusable module description","type":"object"}