{
  "id": "jp-gov-web-crawler",
  "name": "政策网页定向采集器",
  "kind": "connector",
  "version": "0.1.0",
  "description": "从栏目种子发现限定域名、目录和深度内的 HTML 与 PDF；规范化 URL 并保存 PDF 父快照引用。",
  "repository": "src/datumoj/crawlers/gov_web.py",
  "country_region": "JP",
  "data_source": "jp-gov-web",
  "runtime": "local-python >=3.12,<3.14; project locked environment",
  "dependencies": ["lxml", "datumoj.core.contracts", "datumoj.core.models"],
  "inputs": [
    {"name": "CrawlContext", "required": true, "type": "contract", "description": "SourceSpec、只读 Manifest/RawStore、运行时间。scope.seeds 必填；深度默认 2、每种子任务上限默认 200、默认跟进 PDF。"},
    {"name": "FetchTask/FetchResult", "required": true, "type": "contract", "description": "after_fetch 接受执行器结果；不直接执行 HTTP。"}
  ],
  "outputs": "Iterable[FetchTask]；meta 包含 role、seed、depth、每种子计数/上限；子任务含 parent_url、parent_sha256；classify 可返回 spa_shell。",
  "invocation": {"kind": "function", "detail": "discover_crawlers()['gov_web']()；交给 core.runner.run_crawl，实例不可并行用于多个运行。"},
  "permissions": ["读取 Manifest/RawStore", "执行器另需白名单站点 HTTP；采集器无凭据、无存储写权限"],
  "license": "unknown; source redistribution=unverified, usage_scope=internal_only",
  "error_model": "无效配置抛 ValueError，由执行器报告 plan_error；HTTP/robots 失败不追加任务；缺失 raw 的读取错误不吞掉；每种子上限写 meta 并记录 warning。",
  "test": "make check T=tests/crawlers/test_gov_web.py（离线 ReplayTransport / pytest-httpserver）",
  "status": "experimental",
  "maintainers": ["unknown"]
}
